destinationId,name,province,category,averageRating,favouriteTimes,latitude,longitude,description,categories,district,openTime,closeTime
364,Vòng xoay Quảng trường,Tiền Giang,Lịch sử,4.5,0,10.379068,106.3660934,"Quảng trường Ba Đình là quảng trường lớn nhất Việt Nam, nằm trên đường Hùng Vương, quận Ba Đình và là nơi Lăng Chủ tịch Hồ Chí Minh được xây dựng. Quảng trường này còn là nơi ghi nhận nhiều dấu ấn quan trọng trong lịch sử Việt Nam, đặc biệt, vào ngày 2 tháng 9 năm 1945, Chủ tịch Chính phủ Cách mạng lâm thời Việt Nam Dân chủ Cộng hòa Hồ Chí Minh đã đọc bản Tuyên ngôn độc lập khai sinh ra nước Việt Nam Dân chủ Cộng hòa.","['Lịch sử', 'Thiên nhiên']",,,
365,Mãn Đình Hồng Garden,Tiền Giang,Thiên nhiên,4.2,0,10.3759321,106.3201274,"Ngô Đình Diệm là một chính khách người Việt Nam. Ông từng làm quan triều Nguyễn thời vua Bảo Đại, sau đó làm Thủ tướng cuối cùng của Quốc gia Việt Nam, rồi trở thành Tổng thống Đệ nhất Việt Nam Cộng hòa từ năm 1955 sau khi thành công trong việc phế truất Bảo Đại, cho đến khi bị lật đổ vào năm 1963. Ông cũng là lãnh tụ của Đảng Cần lao Nhân vị, đảng cầm quyền chính thức của miền Nam Việt Nam lúc bấy giờ.",['Thiên nhiên'],,,
366,Chùa Hang,Trà Vinh,Biển,4.5,0,9.8870578,106.3450222,"Chùa Hang là một ngôi chùa cổ kính tọa lạc tại Trà Vinh. Đây là điểm đến tâm linh thu hút du khách bởi kiến trúc truyền thống, không gian thanh tịnh và những giá trị văn hóa Phật giáo đặc sắc.","['Biển', 'Lịch sử', 'Thiên nhiên']",,,
367,Di tích thành cổ Tuyên Quang,Tuyên Quang,Núi,4.5,0,21.8192674,105.2150197,Di tích thành cổ Tuyên Quang là di tích lịch sử quan trọng tại Tuyên Quang. Công trình kiến trúc này mang đậm dấu ấn lịch sử và là điểm đến không thể bỏ qua cho những ai yêu thích khám phá văn hóa.,"['Núi', 'Lịch sử']",,,
368,Đài tưởng niệm Tuyên Quang,Tuyên Quang,Unknown,4.5,0,21.8211025,105.2087809,Đài tưởng niệm Tuyên Quang là điểm đến du lịch hấp dẫn tại Tuyên Quang. Nơi đây thu hút du khách bởi vẻ đẹp độc đáo và những trải nghiệm thú vị không thể bỏ qua.,[],,,
369,Đền Hạ,Tuyên Quang,Lịch sử,4.6,0,21.81272019999999,105.2148621,Đền Hạ là một di tích lịch sử - văn hóa quan trọng tại Tuyên Quang. Công trình thờ tự này lưu giữ những giá trị truyền thống và là nơi diễn ra nhiều lễ hội văn hóa đặc sắc hàng năm.,['Lịch sử'],,,
370,Chùa Hang,Tuyên Quang,Lịch sử,4.5,0,21.7844431,105.2593827,"Nam Định là một tỉnh cũ nằm ở phía Nam Đồng bằng sông Hồng, Việt Nam.","['Lịch sử', 'Thiên nhiên']",,,
371,Văn Thánh Miếu vĩnh long,Vĩnh Long,Unknown,4.3,0,10.2427554,105.9846112,Văn Thánh Miếu vĩnh long là điểm đến du lịch hấp dẫn tại Vĩnh Long. Nơi đây thu hút du khách bởi vẻ đẹp độc đáo và những trải nghiệm thú vị không thể bỏ qua.,[],,,
372,Làng văn hóa du lịch Khmer Trà Vinh,Trà Vinh,Biển,4.4,0,9.9144436,106.2987693,Làng văn hóa du lịch Khmer Trà Vinh là làng nghề truyền thống tại Trà Vinh. Du khách có thể trải nghiệm cuộc sống thôn quê thanh bình và tìm hiểu các nghề thủ công đặc sắc của địa phương.,"['Biển', 'Văn hóa']",,,
373,Cốm dẹp Khmer Thạch Sang,Trà Vinh,Thiên nhiên,5.0,0,9.9153076,106.2945304,"Cốm là món ăn được làm từ lúa nếp làm chín bằng cách rang sau đó mang đi giã và được làm sạch bằng cách sàng sảy cho hết vỏ trấu, loại bỏ hết tạp chất, sau đó cũng có loại cốm mang đi hồ cốm bằng nước lá cốm. Món ăn này thường được thấy tại nhiều vùng miền trên đất nước Việt Nam và cũng là món ăn rất thịnh hành trong ẩm thực đồng bằng Bắc Bộ, đặc biệt là tại Hà Nội.",['Thiên nhiên'],,,
374,Chùa Khmer chùa Âng,Trà Vinh,Lịch sử,4.6,0,9.915830299999998,106.3035502,"Ngôi chùa Khmer lộng lẫy nằm giữa những hàng cây, có nhiều tòa tháp vàng, tượng sư tử và sảnh cầu nguyện đẹp mắt.","['Lịch sử', 'Công trình']",,,
375,Bảo Tàng Văn Hóa Dân Tộc Khmer,Trà Vinh,Biển,4.5,0,9.9161858,106.3050168,"Bảo Tàng Văn Hóa Dân Tộc Khmer là bảo tàng nổi tiếng tại Trà Vinh, nơi trưng bày và bảo tồn nhiều hiện vật quý giá. Du khách có thể khám phá lịch sử, văn hóa và di sản thông qua các bộ sưu tập đa dạng.","['Biển', 'Văn hóa']",,,
376,Chùa Khươne | វត្ត ចម្បកមាស,Trà Vinh,Lịch sử,4.5,0,9.9253656,106.3335569,"Chùa Khươne | វត្ត ចម្បកមាស là một ngôi chùa cổ kính tọa lạc tại Trà Vinh. Đây là điểm đến tâm linh thu hút du khách bởi kiến trúc truyền thống, không gian thanh tịnh và những giá trị văn hóa Phật giáo đặc sắc.",['Lịch sử'],,,
377,Nhà Nghỉ Dạ Thảo,Trà Vinh,Unknown,4.2,0,9.9273606,106.329356,"Nguyễn Trọng Trí, thường được biết đến với bút danh Hàn Mặc Tử hay Hàn Mạc Tử, là một nhà thơ người Việt Nam. Là người khởi xướng Trường thơ Loạn và cũng là người tiên phong của dòng thơ lãng mạn hiện đại Việt Nam, ông còn có những bút danh khác trong sự nghiệp gồm Lệ Thanh, Phong Trần và Minh Duệ Thị.",[],,,
378,Chùa Ông Phước Minh Cung 關聖廟 福明宮,Trà Vinh,Lịch sử,4.4,0,9.934469999999997,106.3411545,"Chùa Ông Phước Minh Cung 關聖廟 福明宮 là một ngôi chùa cổ kính tọa lạc tại Trà Vinh. Đây là điểm đến tâm linh thu hút du khách bởi kiến trúc truyền thống, không gian thanh tịnh và những giá trị văn hóa Phật giáo đặc sắc.",['Lịch sử'],,,
379,Khu Du Lịch Vinh Sang,Vĩnh Long,Giải trí,4.0,0,10.2702869,105.9537676,"Khu Du Lịch Vinh Sang là điểm vui chơi giải trí hấp dẫn tại Vĩnh Long. Với nhiều hoạt động thú vị và không gian xanh mát, nơi đây là lựa chọn hoàn hảo cho các gia đình và du khách.",['Giải trí'],,,
380,Nhà Thờ Cù Lao Dài,Vĩnh Long,Biển,4.6,0,10.1601565,106.1827725,"Cù lao Phố là một cù lao được bao bọc bởi hai nhánh của sông Đồng Nai, về hành chính là phường Hiệp Hòa thuộc thành phố Biên Hòa, tỉnh Đồng Nai, Việt Nam.",['Biển'],,,
381,Sadec Bonsai Museum - Bảo Tàng Bonsai Sa Đéc,Vĩnh Long,Văn hóa,4.2,0,10.3479113,105.7315484,"Sadec Bonsai Museum - Bảo Tàng Bonsai Sa Đéc là bảo tàng nổi tiếng tại Vĩnh Long, nơi trưng bày và bảo tồn nhiều hiện vật quý giá. Du khách có thể khám phá lịch sử, văn hóa và di sản thông qua các bộ sưu tập đa dạng.",['Văn hóa'],,,
382,Di tích cửa hữu Thành Long Hồ,Vĩnh Long,Lịch sử,4.0,0,10.2529831,105.970477,Di tích cửa hữu Thành Long Hồ là điểm đến du lịch hấp dẫn tại Vĩnh Long. Nơi đây thu hút du khách bởi vẻ đẹp độc đáo và những trải nghiệm thú vị không thể bỏ qua.,"['Lịch sử', 'Thiên nhiên']",,,
383,Chùa Long Khánh,Vĩnh Long,Lịch sử,4.3,0,10.2467109,105.9847061,"Thanh Cao Tông, Tây Tạng tôn vị Văn Thù Hoàng Đế (文殊皇帝), là Hoàng đế thứ sáu của Nhà Thanh và là Hoàng Đế Mãn Thanh thứ tư sau khi nhập quan. Trong thời gian trị vì của mình, ông chỉ dùng niên hiệu Càn Long (乾隆), nên còn gọi là Càn Long Đế (乾隆帝).",['Lịch sử'],,,
384,Làng Gốm Tư Buôi,Vĩnh Long,Unknown,4.5,0,10.2562326,105.9932534,Làng Gốm Tư Buôi là làng nghề truyền thống tại Vĩnh Long. Du khách có thể trải nghiệm cuộc sống thôn quê thanh bình và tìm hiểu các nghề thủ công đặc sắc của địa phương.,[],,,
385,Đền Thờ Phạm Hùng,Vĩnh Long,Lịch sử,4.6,0,10.2247818,105.9895101,"Đền thờ Chủ tịch Hồ Chí Minh tọa lạc ở ấp Vĩnh Hội, xã Long Đức, thành phố Trà Vinh, tỉnh Trà Vinh, Việt Nam.","['Lịch sử', 'Thiên nhiên']",,,
386,Cầu Đầm Vạc,Vĩnh Phúc,Thiên nhiên,4.5,0,21.2948096,105.5986891,Cầu Đầm Vạc là điểm đến du lịch hấp dẫn tại Vĩnh Phúc. Nơi đây thu hút du khách bởi vẻ đẹp độc đáo và những trải nghiệm thú vị không thể bỏ qua.,"['Thiên nhiên', 'Công trình']",,,
387,Chùa Hà Tiên,Vĩnh Phúc,Lịch sử,4.6,0,21.3265601,105.5984998,"Chùa Hà Tiên là một ngôi chùa cổ kính tọa lạc tại Vĩnh Phúc. Đây là điểm đến tâm linh thu hút du khách bởi kiến trúc truyền thống, không gian thanh tịnh và những giá trị văn hóa Phật giáo đặc sắc.","['Lịch sử', 'Thiên nhiên']",,,
388,Công viên Văn Miếu,Vĩnh Phúc,Thiên nhiên,4.3,0,21.3294968,105.6016518,"Công viên Văn Miếu là điểm vui chơi giải trí hấp dẫn tại Vĩnh Phúc. Với nhiều hoạt động thú vị và không gian xanh mát, nơi đây là lựa chọn hoàn hảo cho các gia đình và du khách.","['Thiên nhiên', 'Giải trí']",,,
389,Điểm Dừng Nghỉ IC4 - Tam Đảo Xanh,Vĩnh Phúc,Unknown,4.2,0,21.3543188,105.6079912,Điểm Dừng Nghỉ IC4 - Tam Đảo Xanh là điểm đến du lịch hấp dẫn tại Vĩnh Phúc. Nơi đây thu hút du khách bởi vẻ đẹp độc đáo và những trải nghiệm thú vị không thể bỏ qua.,[],,,
390,Vườn Hoa Hồng Hà,Yên Bái,Biển,4.0,0,21.6969702,104.8756821,"Sông Hồng là con sông có tổng chiều dài là 1.149 km bắt nguồn từ Vân Nam, Trung Quốc chảy qua miền Bắc Việt Nam và đổ ra vịnh Bắc Bộ, trên đất Việt Nam dài 556 km. Đây là dòng sông quan trọng của nền văn hóa lúa nước Việt Nam.","['Biển', 'Văn hóa', 'Thiên nhiên']",,,
391,Đền thờ Trương Định,Quảng Ngãi,Lịch sử,4.4,0,15.1730609,108.8690953,"Trương Định hay Trương Công Định hoặc Trương Trường Định, là võ quan triều Nguyễn, và là thủ lĩnh chống Pháp giai đoạn 1859 – 1864, trong lịch sử Việt Nam.",['Lịch sử'],,,
392,MŨI BIỂN Nghĩa An Quảng Ngãi,Quảng Ngãi,Biển,4.6,0,15.1385199,108.8971992,"Đức Phổ là một thị xã ven biển nằm ở phía nam tỉnh Quảng Ngãi, Việt Nam.",['Biển'],,,
393,HTX Du lịch Rừng Dừa Nước Mỹ Khê ( TRỤ SỞ CHÍNH ),Quảng Ngãi,Biển,4.7,0,15.1739146,108.8879046,HTX Du lịch Rừng Dừa Nước Mỹ Khê ( TRỤ SỞ CHÍNH ) là điểm đến du lịch hấp dẫn tại Quảng Ngãi. Nơi đây thu hút du khách bởi vẻ đẹp độc đáo và những trải nghiệm thú vị không thể bỏ qua.,"['Biển', 'Thiên nhiên']",,,
394,Bãi biển Đức Lợi,Quảng Ngãi,Biển,4.5,0,15.0710231,108.9055828,"Bãi biển Đức Lợi là bãi biển đẹp nằm tại Quảng Ngãi với bờ cát trắng mịn và làn nước trong xanh. Đây là điểm đến lý tưởng để tắm biển, thư giãn và ngắm hoàng hôn tuyệt đẹp.",['Biển'],,,
395,Núi Tròn,Quảng Ngãi,Núi,4.3,0,15.1689678,108.6829138,"Sơn Tịnh là một huyện đồng bằng thuộc tỉnh Quảng Ngãi, Việt Nam.",['Núi'],,,
396,Bảo tàng Điêu khắc Chăm Đà Nẵng,Đà Nẵng,Văn hóa,4.2,0,16.0603007,108.2232677,Bảo tàng nhỏ gọn trưng bày một bộ sưu tập các tác phẩm điêu khắc và văn hóa như trang phục và dụng cụ.,['Văn hóa'],,,
397,Cầu Vàng,Đà Nẵng,Lịch sử,4.6,0,15.994892,107.9965831,Cầu Vàng là điểm đến du lịch hấp dẫn tại Đà Nẵng. Nơi đây thu hút du khách bởi vẻ đẹp độc đáo và những trải nghiệm thú vị không thể bỏ qua.,"['Lịch sử', 'Công trình']",,,
398,Cầu Rồng,Đà Nẵng,Lịch sử,4.5,0,16.0612215,108.2296818,Cầu Rồng là điểm đến du lịch hấp dẫn tại Đà Nẵng. Nơi đây thu hút du khách bởi vẻ đẹp độc đáo và những trải nghiệm thú vị không thể bỏ qua.,"['Lịch sử', 'Công trình']",,,
399,Nhất Ông,Đà Nẵng,Unknown,4.2,0,16.0347599,107.9909156,Nhất Ông là điểm đến du lịch hấp dẫn tại Đà Nẵng. Nơi đây thu hút du khách bởi vẻ đẹp độc đáo và những trải nghiệm thú vị không thể bỏ qua.,[],,,
400,Tượng Cá Chép Hóa Rồng,Đà Nẵng,Văn hóa,4.5,0,16.06291,108.229815,"Con rồng Việt Nam là đối tượng trang trí xuất hiện trên kiến trúc, điêu khắc và hội họa. Hình tượng rồng Việt Nam mang bản sắc riêng, được xem là hình tượng con rồng nguyên thủy phát triển độc lập. Đồng thời cũng chính là hình ảnh tiền thân của con rồng Trung Hoa, theo trí tưởng tượng của người Việt ở từng giai đoạn lịch sử văn hóa khác nhau. Nó có nét giống và nhiều khác biệt riêng với rồng trong trang trí kiến trúc và hội họa các quốc gia trong Vùng văn hóa Á Đông khác mà chỉ có Việt Nam có như nét vui vẻ, hiền hơn, cái mũi to, nhiều lông, bờm thay vì nhiều nhánh sừng, miệng ngậm ngọc thay vì tay cầm viên minh châu.",['Văn hóa'],,,
401,Hòa Phú Thành Tourist - Trượt thác Đà Nẵng,Đà Nẵng,Thiên nhiên,4.4,0,15.9577622,107.9916977,"Hòa Phú Thành Tourist - Trượt thác Đà Nẵng là trải nghiệm du lịch độc đáo tại Đà Nẵng. Tham gia tour này, du khách sẽ được khám phá ẩm thực và văn hóa địa phương đặc sắc.",['Thiên nhiên'],,,
402,Bảo tàng Đà Nẵng,Đà Nẵng,Văn hóa,4.1,0,16.0745542,108.2239668,"Bảo tàng về lịch sử Đà Nẵng, nơi trưng bày hiện vật văn hóa và quân sự trong một không gian hiện đại.",['Văn hóa'],,,
403,Mũi Nghê,Đà Nẵng,Biển,4.4,0,16.1186244,108.3368715,"Núi Sơn Trà, hoặc gọi là núi Khỉ, là một ngọn núi và bán đảo nằm ở quận Sơn Trà, thành phố Đà Nẵng, Việt Nam, phía tây giáp vịnh Đà Nẵng, phía đông bắc và phía đông nam giáp biển Đông, phía tây nam do phù sa sông Hàn bồi đắp mà nối với đất liền hình thành bán đảo Sơn Trà, là điểm cuối cùng của dãy núi Trường Sơn Bắc. Bến cảng Tiên Sa thuộc cảng Đà Nẵng nằm ở chân núi phía tây, sát gần bãi biển Tiên Sa.","['Biển', 'Núi']",,,
404,Ghềnh Bàng,Đà Nẵng,Biển,4.5,0,16.1124336,108.3116322,"Khu vực ven biển nổi tiếng có khỉ, một khu vực nhỏ đầy cát, các phiến đá gồ ghề và vách đá phủ đầy cây xanh.",['Biển'],,,
405,Bãi Tắm Non Nước,Đà Nẵng,Biển,4.5,0,16.0027923,108.2699727,Bãi Tắm Non Nước là điểm đến du lịch hấp dẫn tại Đà Nẵng. Nơi đây thu hút du khách bởi vẻ đẹp độc đáo và những trải nghiệm thú vị không thể bỏ qua.,['Biển'],,,
406,Hải đăng Tiên Sa,Đà Nẵng,Unknown,4.3,0,16.1396875,108.3220625,Hải đăng Tiên Sa là điểm đến du lịch hấp dẫn tại Đà Nẵng. Nơi đây thu hút du khách bởi vẻ đẹp độc đáo và những trải nghiệm thú vị không thể bỏ qua.,[],,,
407,Biển Mỹ Khê,Đà Nẵng,Biển,4.6,0,16.0643167,108.2465468,Biển Mỹ Khê là điểm đến du lịch hấp dẫn tại Đà Nẵng. Nơi đây thu hút du khách bởi vẻ đẹp độc đáo và những trải nghiệm thú vị không thể bỏ qua.,['Biển'],,,
408,Khu Du Lịch Sinh Thái Lái Thiêu,Đà Nẵng,Văn hóa,3.8,0,15.9562015,107.9754714,"Khu Du Lịch Sinh Thái Lái Thiêu là điểm vui chơi giải trí hấp dẫn tại Đà Nẵng. Với nhiều hoạt động thú vị và không gian xanh mát, nơi đây là lựa chọn hoàn hảo cho các gia đình và du khách.","['Văn hóa', 'Thiên nhiên', 'Giải trí']",,,
409,Làng Toom Sara Đà Nẵng,Đà Nẵng,Unknown,4.5,0,15.9574226,107.9949721,Làng Toom Sara Đà Nẵng là làng nghề truyền thống tại Đà Nẵng. Du khách có thể trải nghiệm cuộc sống thôn quê thanh bình và tìm hiểu các nghề thủ công đặc sắc của địa phương.,[],,,
410,Bãi biển Sơn Trà,Đà Nẵng,Biển,4.8,0,16.0991295,108.2550616,"Bãi biển Sơn Trà là bãi biển đẹp nằm tại Đà Nẵng với bờ cát trắng mịn và làn nước trong xanh. Đây là điểm đến lý tưởng để tắm biển, thư giãn và ngắm hoàng hôn tuyệt đẹp.",['Biển'],,,
411,Bảo tàng Mỹ thuật Đà Nẵng,Đà Nẵng,Văn hóa,4.5,0,16.0711877,108.2179411,"Bảo tàng mỹ thuật trưng bày tranh, tượng, đồ gốm và tác phẩm khác trong không gian hiện đại có quán cà phê.",['Văn hóa'],,,
412,Suối mơ Khe Răm,Đà Nẵng,Thiên nhiên,4.7,0,16.1463556,108.0780073,"Suối mơ Khe Răm là điểm du lịch sinh thái tại Đà Nẵng. Với dòng nước mát lành và cảnh quan thiên nhiên tươi đẹp, nơi đây là địa điểm lý tưởng để thư giãn và tận hưởng không khí trong lành.",['Thiên nhiên'],,,
413,Rừng thông Bồ Bồ,Đà Nẵng,Thiên nhiên,4.5,0,15.9196025,108.1640854,Rừng thông Bồ Bồ là điểm đến du lịch hấp dẫn tại Đà Nẵng. Nơi đây thu hút du khách bởi vẻ đẹp độc đáo và những trải nghiệm thú vị không thể bỏ qua.,['Thiên nhiên'],,,
414,Bảo tàng Đồng Đình,Đà Nẵng,Núi,4.1,0,16.1011538,108.2753793,Bảo tàng cổ kính giữa khung cảnh núi non trưng bày gốm sứ trong vùng và một ngôi nhà truyền thống.,"['Núi', 'Lịch sử', 'Văn hóa']",,,
415,Công viên Kỳ Quan,Đà Nẵng,Giải trí,4.4,0,16.0988248,108.224412,"Công viên Kỳ Quan là điểm vui chơi giải trí hấp dẫn tại Đà Nẵng. Với nhiều hoạt động thú vị và không gian xanh mát, nơi đây là lựa chọn hoàn hảo cho các gia đình và du khách.",['Giải trí'],,,
416,Đá Mỹ Nghệ Non Nước,Đà Nẵng,Biển,4.4,0,15.995601,108.263743,Đá Mỹ Nghệ Non Nước là điểm đến du lịch hấp dẫn tại Đà Nẵng. Nơi đây thu hút du khách bởi vẻ đẹp độc đáo và những trải nghiệm thú vị không thể bỏ qua.,['Biển'],,,
417,Sơn Trà Tịnh Viên,Đà Nẵng,Unknown,4.6,0,16.1147325,108.2572469,Sơn Trà Tịnh Viên là điểm đến du lịch hấp dẫn tại Đà Nẵng. Nơi đây thu hút du khách bởi vẻ đẹp độc đáo và những trải nghiệm thú vị không thể bỏ qua.,[],,,
418,Quốc Tự Tam Thai,Đà Nẵng,Thiên nhiên,4.6,0,16.0038425,108.2624426,"Tam quốc diễn nghĩa, nguyên tên là Tam quốc chí thông tục diễn nghĩa, là một cuốn tiểu thuyết dã sử về Lịch sử Trung Quốc được nhà văn La Quán Trung viết vào thế kỷ 14. Tiểu thuyết có nội dung kể về một thời kỳ hỗn loạn trong lịch sử Trung Hoa là thời Tam Quốc (190–280) với 120 chương hồi, theo phương pháp bảy phần thực, ba phần hư. Tiểu thuyết này được xem là một tác phẩm văn học kinh điển, và là một trong Tứ đại danh tác của văn học Trung Quốc.",['Thiên nhiên'],,,
419,The Monkey Mountain,Đà Nẵng,Thiên nhiên,4.5,0,16.1159837,108.273341,"RMK-BRJ là một liên hợp xây dựng của Mỹ bao gồm 4 công ty nằm trong số các công ty lớn nhất của Mỹ, do Hải quân Hoa Kỳ thành lập trong Chiến tranh Việt Nam để xây dựng cơ sở hạ tầng quan trọng ở miền Nam Việt Nam, nhằm tạo điều kiện cho người Mỹ leo thang đưa quân đội và khí tài của Mỹ vào Việt Nam. Hợp đồng xây dựng của RMK-BRJ trị giá 1,9 tỷ đô la, hoàn thành một chương trình xây dựng được coi là lớn nhất trong lịch sử tính đến thời điểm đó.",['Thiên nhiên'],,,
420,Cây thông Cô đơn,Đà Nẵng,Unknown,4.6,0,16.1688557,108.1263136,Cây thông Cô đơn là điểm đến du lịch hấp dẫn tại Đà Nẵng. Nơi đây thu hút du khách bởi vẻ đẹp độc đáo và những trải nghiệm thú vị không thể bỏ qua.,[],,,
421,Leaf Village & Farm - Làng Lá,Đà Nẵng,Unknown,4.6,0,16.1240295,108.0062404,Leaf Village & Farm - Làng Lá là điểm đến du lịch hấp dẫn tại Đà Nẵng. Nơi đây thu hút du khách bởi vẻ đẹp độc đáo và những trải nghiệm thú vị không thể bỏ qua.,[],,,
422,Chùa Pháp Lâm,Đà Nẵng,Lịch sử,4.6,0,16.0622908,108.2155449,Ngôi chùa sặc sỡ có pho tượng Phật khổng lồ bằng vàng đang ngồi và các tác phẩm thủ công độc đáo.,['Lịch sử'],,,
423,Chùa Phổ Đà,Đà Nẵng,Lịch sử,4.5,0,16.0559501,108.2186395,"Chùa Phổ Đà là một ngôi chùa cổ kính tọa lạc tại Đà Nẵng. Đây là điểm đến tâm linh thu hút du khách bởi kiến trúc truyền thống, không gian thanh tịnh và những giá trị văn hóa Phật giáo đặc sắc.",['Lịch sử'],,,
424,Công Viên Nước Mikazuki 365,Đà Nẵng,Giải trí,4.2,0,16.0921811,108.1441576,"Công Viên Nước Mikazuki 365 là điểm vui chơi giải trí hấp dẫn tại Đà Nẵng. Với nhiều hoạt động thú vị và không gian xanh mát, nơi đây là lựa chọn hoàn hảo cho các gia đình và du khách.",['Giải trí'],,,
425,Chùa Non Nước,Đà Nẵng,Biển,4.4,0,16.00275,108.2645895,Ngôi chùa trên núi nổi tiếng với nhiều tượng Phật và hang động tự nhiên với các điện thờ bên trong hang.,"['Biển', 'Núi', 'Lịch sử', 'Thiên nhiên']",,,
426,Sun World Bà Nà Hills,Đà Nẵng,Núi,4.5,0,16.0265144,108.0327972,"Công viên giải trí có các trò chơi cảm giác mạnh, cáp treo và Cầu Vàng nhìn ra toàn cảnh núi non.","['Núi', 'Lịch sử', 'Giải trí', 'Công trình']",,,
427,Công viên Biển Đông,Đà Nẵng,Biển,4.6,0,16.0703173,108.2458368,"Công viên Biển Đông là điểm vui chơi giải trí hấp dẫn tại Đà Nẵng. Với nhiều hoạt động thú vị và không gian xanh mát, nơi đây là lựa chọn hoàn hảo cho các gia đình và du khách.","['Biển', 'Giải trí']",,,
428,Chùa Linh Ứng,Đà Nẵng,Lịch sử,4.7,0,16.1002606,108.2777478,"Chùa Linh Ứng là một ngôi chùa cổ kính tọa lạc tại Đà Nẵng. Đây là điểm đến tâm linh thu hút du khách bởi kiến trúc truyền thống, không gian thanh tịnh và những giá trị văn hóa Phật giáo đặc sắc.",['Lịch sử'],,,
429,Cua Cùi chỏ,Đà Nẵng,Unknown,4.8,0,16.1847912,108.1368315,Cua Cùi chỏ là điểm đến du lịch hấp dẫn tại Đà Nẵng. Nơi đây thu hút du khách bởi vẻ đẹp độc đáo và những trải nghiệm thú vị không thể bỏ qua.,[],,,
430,Tượng đài Mẹ Nhu,Đà Nẵng,Công trình,4.6,0,16.0652433,108.1833896,Tượng đài Mẹ Nhu là điểm đến du lịch hấp dẫn tại Đà Nẵng. Nơi đây thu hút du khách bởi vẻ đẹp độc đáo và những trải nghiệm thú vị không thể bỏ qua.,['Công trình'],,,
431,Bãi biển Non Nước,Đà Nẵng,Biển,4.3,0,15.9955335,108.2738648,"Bãi biển Non Nước là bãi biển đẹp nằm tại Đà Nẵng với bờ cát trắng mịn và làn nước trong xanh. Đây là điểm đến lý tưởng để tắm biển, thư giãn và ngắm hoàng hôn tuyệt đẹp.",['Biển'],,,
432,Fantasy Park,Đà Nẵng,Unknown,4.4,0,15.9972041,107.988763,"Fantasy Park là điểm vui chơi giải trí hấp dẫn tại Đà Nẵng. Với nhiều hoạt động thú vị và không gian xanh mát, nơi đây là lựa chọn hoàn hảo cho các gia đình và du khách.",[],,,
433,Du Thuyền Sông Hàn Đà Nẵng (Stations Tickets),Đà Nẵng,Unknown,4.3,0,16.0791411,108.2242785,Du Thuyền Sông Hàn Đà Nẵng (Stations Tickets) là điểm đến du lịch hấp dẫn tại Đà Nẵng. Nơi đây thu hút du khách bởi vẻ đẹp độc đáo và những trải nghiệm thú vị không thể bỏ qua.,[],,,
434,Cột cờ Hà Nội,Hà Nội,Lịch sử,4.5,0,21.0325556,105.8398039,Công trình di tích lịch sử chiến tranh gồm tháp đá và lá cờ Việt Nam trong bảo tàng quân đội.,"['Lịch sử', 'Văn hóa', 'Công trình']",,,
435,Chùa Một Cột,Hà Nội,Lịch sử,4.3,0,21.0358277,105.8336206,"Ngôi chùa thờ Phật đã được xây lại, vốn được dựng lên vào năm 1049 với thiết kế hoa sen.",['Lịch sử'],,,
436,Khu Phố Cổ Hà Nội,Hà Nội,Lịch sử,4.6,0,21.034059,105.8506368,"Khu giao thương lâu đời, có chợ đêm, những con ngõ nhỏ, quầy hàng rong và nhà cửa xây hình ống.","['Lịch sử', 'Văn hóa']",,,
437,Lăng Chủ tịch Hồ Chí Minh,Hà Nội,Lịch sử,4.5,0,21.0368973,105.8346667,"Thi hài của Chủ tịch Hồ Chí Minh, lãnh tụ nước Việt Nam, được đặt tại lăng mộ và khu di tích lịch sử này.","['Lịch sử', 'Thiên nhiên']",,,
