destinationId,name,province,category,averageRating,favouriteTimes,latitude,longitude,description,categories,district,openTime,closeTime
987,Thác Rồng Trung Lèng Hồ - Mường Hum,Lai Châu,Thiên nhiên,4.7,0,22.4867583,103.6511236,"Trung Lèng Hồ là một xã thuộc huyện Bát Xát, tỉnh Lào Cai, Việt Nam, cách huyện lị khoảng 45 km về phía tây nam và là xã rộng nhất huyện.",['Thiên nhiên'],,,
988,Choản Thèn,Lai Châu,Unknown,4.5,0,22.6640459,103.6027798,Choản Thèn là điểm đến du lịch hấp dẫn tại Lai Châu. Nơi đây thu hút du khách bởi vẻ đẹp độc đáo và những trải nghiệm thú vị không thể bỏ qua.,[],,,
989,Khu du lịch Thác Đamb'ri,Lâm Đồng,Thiên nhiên,4.3,0,11.6420438,107.7428737,Thác nước lớn và quang cảnh hùng vĩ nằm giữa thiên nhiên hoang sơ với lối đi bộ và nhà hàng.,"['Thiên nhiên', 'Giải trí']",,,
990,Đồi Mộng Mơ Đà Lạt,Lâm Đồng,Thiên nhiên,4.3,0,11.9778728,108.445152,Khu nghỉ dưỡng nằm giữa những rừng thông và vườn hoa rực rỡ với nhà hàng và sân gôn 9 lỗ.,['Thiên nhiên'],,,
991,Thác Tam Hợp (Chùa Di Đà),Lâm Đồng,Lịch sử,4.5,0,11.642168,107.7319226,Thác Tam Hợp (Chùa Di Đà) là điểm đến du lịch hấp dẫn tại Lâm Đồng. Nơi đây thu hút du khách bởi vẻ đẹp độc đáo và những trải nghiệm thú vị không thể bỏ qua.,"['Lịch sử', 'Văn hóa', 'Thiên nhiên']",,,
992,Samten Hills Dalat,Lâm Đồng,Unknown,4.4,0,11.7048496,108.4179427,Samten Hills Dalat là điểm đến du lịch hấp dẫn tại Lâm Đồng. Nơi đây thu hút du khách bởi vẻ đẹp độc đáo và những trải nghiệm thú vị không thể bỏ qua.,[],,,
993,Khu Du Lịch Lang Biang,Lâm Đồng,Biển,4.1,0,12.0193208,108.4243879,"Khu Du Lịch Lang Biang là điểm vui chơi giải trí hấp dẫn tại Lâm Đồng. Với nhiều hoạt động thú vị và không gian xanh mát, nơi đây là lựa chọn hoàn hảo cho các gia đình và du khách.","['Biển', 'Núi', 'Giải trí']",,,
994,Quảng trường Lâm Viên,Lâm Đồng,Thiên nhiên,4.5,0,11.9393622,108.445203,"Quảng trường ven hồ nổi bật với những tòa nhà ốp kính hiện đại nổi tiếng, có nhiều quầy thực phẩm và sự kiện âm nhạc.","['Thiên nhiên', 'Công trình']",,,
995,Khu du lịch Quỷ Núi,Lâm Đồng,Núi,4.5,0,12.0022429,108.3499998,"Khu du lịch Quỷ Núi nằm ở thôn Đạ Nghịt, xã Lát, huyện Lạc Dương, tỉnh Lâm Đồng. Khu du lịch trực thuộc Công ty cổ phần đầu tư & khai thác du lịch QN-SM.","['Núi', 'Lịch sử', 'Thiên nhiên', 'Giải trí']",,,
996,Thác Voi,Lâm Đồng,Thiên nhiên,4.3,0,11.8235719,108.3348747,"Thác Voi hay có tên là thác Liêng Rơwoa, thuộc thị trấn Nam Ban, huyện Lâm Hà, Lâm Đồng, nằm trên dòng sông Cam Ly. Thác nằm cách Đà Lạt chừng 25 km, có chiều rộng khoảng 40m, chiều cao hơn 30m. Bên thác có những tảng đá như chú voi con nên có tên gọi là thác Voi. Thác Voi ngày đêm ầm ầm đổ nước tạo nên những âm thanh như tiếng gầm của thú rừng.",['Thiên nhiên'],,,
997,Khu Du Lịch Sinh Thái Hoa Sơn Điền Trang,Lâm Đồng,Biển,3.9,0,11.9338538,108.3761498,"Khu du lịch sinh thái Tràng An là một khu du lịch sinh thái nằm trong Quần thể di sản thế giới Tràng An thuộc tỉnh Ninh Bình. Nơi đây đã được Chính phủ Việt Nam xếp hạng di tích quốc gia đặc biệt quan trọng và UNESCO công nhận là di sản thế giới kép từ năm 2014. Tràng An với hệ thống dãy núi đá vôi có tuổi địa chất khoảng 250 triệu năm, qua thời gian dài phong hóa bởi sự biến đổi của Trái Đất, khí hậu, biển tiến, biển thoái đã mang trong mình hàng trăm thung lũng, hang động, hồ đầm. Danh thắng này là nơi bảo tồn và chứa đựng nhiều hệ sinh thái rừng ngập nước, rừng trên núi đá vôi, các di chỉ khảo cổ học và di tích lịch sử văn hóa. Hệ thống núi đá, sông suối, rừng và hang động ở Tràng An rất hiểm trở nên được Vua Đinh Tiên Hoàng chọn làm thành Nam bảo vệ kinh đô Hoa Lư ở thế kỷ X và sau đó Nhà Trần sử dụng làm hành cung Vũ Lâm trong kháng chiến Nguyên Mông. Hiện nay nơi đây còn nhiều di tích lịch sử thời Đinh và thời Trần.","['Biển', 'Núi', 'Lịch sử', 'Văn hóa', 'Thiên nhiên', 'Giải trí']",,,
998,Đồi Thiên Phúc Đức,Lâm Đồng,Núi,4.4,0,11.9946058,108.4285696,Ngọn đồi rợp bóng cây thông có con đường mòn dẫn lối đến và nổi tiếng với cảnh bình minh trên thung lũng sương mù bên dưới.,['Núi'],,,
999,Thác Triệu Hải,Lâm Đồng,Biển,4.3,0,11.5092057,107.5464371,Thác Triệu Hải là điểm đến du lịch hấp dẫn tại Lâm Đồng. Nơi đây thu hút du khách bởi vẻ đẹp độc đáo và những trải nghiệm thú vị không thể bỏ qua.,"['Biển', 'Núi', 'Thiên nhiên']",,,
1000,Khu du lịch Fresh Garden Dalat,Lâm Đồng,Giải trí,4.2,0,11.9476933,108.4090729,"Khu du lịch Fresh Garden Dalat là điểm vui chơi giải trí hấp dẫn tại Lâm Đồng. Với nhiều hoạt động thú vị và không gian xanh mát, nơi đây là lựa chọn hoàn hảo cho các gia đình và du khách.",['Giải trí'],,,
1001,Lavender Đà Lạt,Lâm Đồng,Unknown,4.0,0,11.8957269,108.4210931,Lavender Đà Lạt là điểm đến du lịch hấp dẫn tại Lâm Đồng. Nơi đây thu hút du khách bởi vẻ đẹp độc đáo và những trải nghiệm thú vị không thể bỏ qua.,[],,,
1002,Điểm Du Lịch Chuồn Chuồn,Lâm Đồng,Biển,4.3,0,11.8890463,108.3492731,"Quảng Nam là một tỉnh cũ ven biển nằm ở cực bắc khu vực duyên hải Nam Trung Bộ, miền Trung của Việt Nam. Quảng Nam nằm trong vùng kinh tế trọng điểm miền Trung.",['Biển'],,,
1003,Tâm Châu Farm,Lâm Đồng,Văn hóa,4.3,0,11.5952884,107.7437276,Tâm Châu Farm là điểm đến du lịch hấp dẫn tại Lâm Đồng. Nơi đây thu hút du khách bởi vẻ đẹp độc đáo và những trải nghiệm thú vị không thể bỏ qua.,['Văn hóa'],,,
1004,DINH BẢO ĐẠI III,Lâm Đồng,Unknown,4.1,0,11.9299576,108.4296378,"Cung điện rộng lớn của vị hoàng đế cuối cùng tại Việt Nam, hoàn thành năm 1938 với các chuyến tham quan và vườn kiểng.",[],,,
1005,DỐC NHÀ LÀNG,Lâm Đồng,Unknown,4.1,0,11.9436489,108.4344191,DỐC NHÀ LÀNG là điểm đến du lịch hấp dẫn tại Lâm Đồng. Nơi đây thu hút du khách bởi vẻ đẹp độc đáo và những trải nghiệm thú vị không thể bỏ qua.,[],,,
1006,Nhà thờ Mai Anh,Lâm Đồng,Thiên nhiên,4.6,0,11.9496299,108.4301622,"Nhà thờ màu hồng nổi tiếng, tọa lạc trong khung cảnh yên bình, có khu vườn đẹp và cửa hàng nhỏ.","['Thiên nhiên', 'Công trình']",,,
1007,Khu Du Lịch Cáp Treo Đà Lạt,Lâm Đồng,Thiên nhiên,4.4,0,11.9231945,108.443788,"Cáp treo nhiều màu sắc nhìn ra toàn cảnh thành phố và rừng thông, ngoài ra còn đi đến Thiền Viện Trúc Lâm.","['Thiên nhiên', 'Giải trí']",,,
1008,Đường Hầm Hỏa Xa Đà Lạt,Lâm Đồng,Unknown,4.0,0,11.9002977,108.531592,Đường Hầm Hỏa Xa Đà Lạt là điểm đến du lịch hấp dẫn tại Lâm Đồng. Nơi đây thu hút du khách bởi vẻ đẹp độc đáo và những trải nghiệm thú vị không thể bỏ qua.,[],,,
1009,Vườn hoa thành phố Đà Lạt,Lâm Đồng,Văn hóa,4.2,0,11.9502479,108.4498289,Vườn hoa thành phố Đà Lạt là điểm đến du lịch hấp dẫn tại Lâm Đồng. Nơi đây thu hút du khách bởi vẻ đẹp độc đáo và những trải nghiệm thú vị không thể bỏ qua.,['Văn hóa'],,,
1010,The Florest Hoa Trong Rừng,Lâm Đồng,Thiên nhiên,4.4,0,11.9039342,108.3674764,The Florest Hoa Trong Rừng là điểm đến du lịch hấp dẫn tại Lâm Đồng. Nơi đây thu hút du khách bởi vẻ đẹp độc đáo và những trải nghiệm thú vị không thể bỏ qua.,['Thiên nhiên'],,,
1011,Dapa Hill Dalat,Lâm Đồng,Unknown,4.4,0,11.9024266,108.3442219,Dapa Hill Dalat là điểm đến du lịch hấp dẫn tại Lâm Đồng. Nơi đây thu hút du khách bởi vẻ đẹp độc đáo và những trải nghiệm thú vị không thể bỏ qua.,[],,,
1012,Làng hoa Vạn Thành - Khu du lịch VẠN HOA ĐÀ LẠT,Lâm Đồng,Núi,4.4,0,11.9470427,108.4131516,"Làng hoa Vạn Thành - Khu du lịch VẠN HOA ĐÀ LẠT là điểm vui chơi giải trí hấp dẫn tại Lâm Đồng. Với nhiều hoạt động thú vị và không gian xanh mát, nơi đây là lựa chọn hoàn hảo cho các gia đình và du khách.","['Núi', 'Văn hóa', 'Giải trí']",,,
1013,Chùa Tam Thanh,Lạng Sơn,Lịch sử,4.4,0,21.8555833,106.7471727,Hang động rộng lớn với khối đá tự nhiên và tượng Phật nổi tiếng này có tour tham quan và cầu nguyện.,"['Lịch sử', 'Thiên nhiên', 'Công trình']",,,
1014,Khu Du Lịch Mẫu Sơn,Lạng Sơn,Núi,4.1,0,21.848854,106.9172257,"Khu Du Lịch Mẫu Sơn là điểm vui chơi giải trí hấp dẫn tại Lạng Sơn. Với nhiều hoạt động thú vị và không gian xanh mát, nơi đây là lựa chọn hoàn hảo cho các gia đình và du khách.","['Núi', 'Giải trí']",,,
1015,Thành Cổ Lạng Sơn,Lạng Sơn,Núi,4.4,0,21.8412242,106.7552715,Thành Cổ Lạng Sơn là di tích lịch sử quan trọng tại Lạng Sơn. Công trình kiến trúc này mang đậm dấu ấn lịch sử và là điểm đến không thể bỏ qua cho những ai yêu thích khám phá văn hóa.,"['Núi', 'Lịch sử']",,,
1016,Động Nhị Thanh,Lạng Sơn,Núi,4.5,0,21.8513034,106.7517012,Động Nhị Thanh là điểm đến du lịch hấp dẫn tại Lạng Sơn. Nơi đây thu hút du khách bởi vẻ đẹp độc đáo và những trải nghiệm thú vị không thể bỏ qua.,['Núi'],,,
1017,Thung lũng Mường Hoa,Lào Cai,Núi,4.6,0,22.314183,103.8765109,Thung lũng Mường Hoa là điểm đến du lịch hấp dẫn tại Lào Cai. Nơi đây thu hút du khách bởi vẻ đẹp độc đáo và những trải nghiệm thú vị không thể bỏ qua.,['Núi'],,,
1018,Khu Du Lịch Cát Cát - Sapa,Lào Cai,Núi,4.1,0,22.3310248,103.8339731,"Bản Cát Cát hay thôn Cát Cát là một làng dân tộc Mông thuộc xã Hoàng Liên, thị xã Sa Pa, tỉnh Lào Cai, Việt Nam, cách trung tâm thị xã 2 km. Đây là điểm tham quan hấp dẫn của du lịch Sa Pa nói riêng và Lào Cai nói chung.","['Núi', 'Giải trí']",,,
1019,Bãi Đá Cổ Sa Pa,Lào Cai,Lịch sử,4.0,0,22.3041291,103.8986613,Bãi Đá Cổ Sa Pa là điểm đến du lịch hấp dẫn tại Lào Cai. Nơi đây thu hút du khách bởi vẻ đẹp độc đáo và những trải nghiệm thú vị không thể bỏ qua.,['Lịch sử'],,,
1020,Khu Du Lịch Sinh Thái Hàm Rồng SaPa,Lào Cai,Núi,4.3,0,22.334574,103.8477709,Đỉnh núi nhìn ra Sapa với con đường quanh co nằm giữa thảm thực vật tươi tốt đến đỉnh hình đầu rồng.,"['Núi', 'Giải trí']",,,
1021,Thung Lũng Mường Hoa,Lào Cai,Núi,4.7,0,22.307573,103.893106,Thung Lũng Mường Hoa là điểm đến du lịch hấp dẫn tại Lào Cai. Nơi đây thu hút du khách bởi vẻ đẹp độc đáo và những trải nghiệm thú vị không thể bỏ qua.,['Núi'],,,
1022,Điểm Check-in,Lào Cai,Unknown,4.6,0,22.3137965,103.8608301,"A Mú Sung là một xã thuộc huyện Bát Xát, tỉnh Lào Cai, Việt Nam.",[],,,
1023,Tu Viện Cổ Tả Phìn,Lào Cai,Lịch sử,4.1,0,22.3773113,103.8515496,Tu Viện Cổ Tả Phìn là điểm đến du lịch hấp dẫn tại Lào Cai. Nơi đây thu hút du khách bởi vẻ đẹp độc đáo và những trải nghiệm thú vị không thể bỏ qua.,['Lịch sử'],,,
1024,Chùa Tôn Thạnh,Long An,Lịch sử,4.6,0,10.605311,106.6463739,"Chùa Tôn Thạnh là một ngôi chùa cổ kính tọa lạc tại Long An. Đây là điểm đến tâm linh thu hút du khách bởi kiến trúc truyền thống, không gian thanh tịnh và những giá trị văn hóa Phật giáo đặc sắc.","['Lịch sử', 'Thiên nhiên']",,,
1025,Nhà Trăm Cột,Long An,Lịch sử,4.2,0,10.4824971,106.6914738,"Nhà trăm cột tọa lạc tại số 128, ấp Cầu Ngang, xã Long Hựu Đông, huyện Cần Đước, tỉnh Long An, Việt Nam. Đây là một di tích lịch sử cấp quốc gia, và là một trọng điểm du lịch của tỉnh.","['Lịch sử', 'Công trình']",,,
1026,Công viên 7 Kỳ Quan,Long An,Lịch sử,4.3,0,10.9004266,106.4616251,"Công viên có các công trình thu nhỏ về các địa danh trên thế giới như Đền Taj Mahal, Nhà hát Opera Sydney và Tháp Eiffel.","['Lịch sử', 'Giải trí', 'Công trình']",,,
1027,Quảng Trường Happyland - Khu Du Lịch Happyland,Long An,Giải trí,4.3,0,10.6368218,106.461227,Mister Fitness Supermodel Vietnam là cuộc thi sắc đẹp dành cho nam giới được tổ chức lần đầu vào năm 2016. Đương kim Mister Fitness Supermodel Vietnam 2024 là Nguyễn Tiến Đạt đến từ Vĩnh Long.,['Giải trí'],,,
1028,Chavi Garden - Khu du lịch sinh thái giáo dục trải nghiệm,Long An,Giải trí,4.8,0,10.7373942,106.3612175,"Chavi Garden - Khu du lịch sinh thái giáo dục trải nghiệm là điểm vui chơi giải trí hấp dẫn tại Long An. Với nhiều hoạt động thú vị và không gian xanh mát, nơi đây là lựa chọn hoàn hảo cho các gia đình và du khách.",['Giải trí'],,,
1029,Khu du lịch Cánh Đồng Bất Tận,Long An,Thiên nhiên,4.3,0,10.7251072,106.0848807,"Khu du lịch Cánh Đồng Bất Tận là điểm vui chơi giải trí hấp dẫn tại Long An. Với nhiều hoạt động thú vị và không gian xanh mát, nơi đây là lựa chọn hoàn hảo cho các gia đình và du khách.","['Thiên nhiên', 'Giải trí']",,,
1030,Khu du lịch RỪNG sinh thái Làng Nổi Tân Lập,Long An,Biển,4.1,0,10.7147804,105.9875838,"Khu du lịch sinh thái Tràng An là một khu du lịch sinh thái nằm trong Quần thể di sản thế giới Tràng An thuộc tỉnh Ninh Bình. Nơi đây đã được Chính phủ Việt Nam xếp hạng di tích quốc gia đặc biệt quan trọng và UNESCO công nhận là di sản thế giới kép từ năm 2014. Tràng An với hệ thống dãy núi đá vôi có tuổi địa chất khoảng 250 triệu năm, qua thời gian dài phong hóa bởi sự biến đổi của Trái Đất, khí hậu, biển tiến, biển thoái đã mang trong mình hàng trăm thung lũng, hang động, hồ đầm. Danh thắng này là nơi bảo tồn và chứa đựng nhiều hệ sinh thái rừng ngập nước, rừng trên núi đá vôi, các di chỉ khảo cổ học và di tích lịch sử văn hóa. Hệ thống núi đá, sông suối, rừng và hang động ở Tràng An rất hiểm trở nên được Vua Đinh Tiên Hoàng chọn làm thành Nam bảo vệ kinh đô Hoa Lư ở thế kỷ X và sau đó Nhà Trần sử dụng làm hành cung Vũ Lâm trong kháng chiến Nguyên Mông. Hiện nay nơi đây còn nhiều di tích lịch sử thời Đinh và thời Trần.","['Biển', 'Núi', 'Lịch sử', 'Văn hóa', 'Thiên nhiên', 'Giải trí']",,,
1031,Tượng đài Chiến thắng Long An,Long An,Công trình,4.6,0,10.5594439,106.4174041,Tượng đài Chiến thắng Long An là điểm đến du lịch hấp dẫn tại Long An. Nơi đây thu hút du khách bởi vẻ đẹp độc đáo và những trải nghiệm thú vị không thể bỏ qua.,['Công trình'],,,
1032,Khu di tích căn cứ Bình Thành,Long An,Lịch sử,4.4,0,10.8116662,106.2201387,Khu di tích căn cứ Bình Thành là điểm đến du lịch hấp dẫn tại Long An. Nơi đây thu hút du khách bởi vẻ đẹp độc đáo và những trải nghiệm thú vị không thể bỏ qua.,"['Lịch sử', 'Thiên nhiên']",,,
1033,Trường đua Happyland,Long An,Thiên nhiên,4.0,0,10.6377623,106.4613272,Trường đua Happyland là điểm đến du lịch hấp dẫn tại Long An. Nơi đây thu hút du khách bởi vẻ đẹp độc đáo và những trải nghiệm thú vị không thể bỏ qua.,['Thiên nhiên'],,,
1034,Khu di tích Núi Đất,Long An,Núi,4.0,0,10.7706427,105.9390163,Khu di tích Núi Đất là điểm đến du lịch hấp dẫn tại Long An. Nơi đây thu hút du khách bởi vẻ đẹp độc đáo và những trải nghiệm thú vị không thể bỏ qua.,"['Núi', 'Lịch sử', 'Thiên nhiên']",,,
1035,Làng Nổi Tân Lập,Long An,Thiên nhiên,4.0,0,10.7148701,105.9873891,"Khu nghỉ mát yên bình trong rừng, nhìn ra sông, có nhà hàng và phòng ở sáng sủa, bài trí đơn giản.",['Thiên nhiên'],,,
1036,Cát tường phú sinh - khu du lịch sinh thái,Long An,Biển,4.4,0,10.9005735,106.4639338,"Khu du lịch sinh thái Tràng An là một khu du lịch sinh thái nằm trong Quần thể di sản thế giới Tràng An thuộc tỉnh Ninh Bình. Nơi đây đã được Chính phủ Việt Nam xếp hạng di tích quốc gia đặc biệt quan trọng và UNESCO công nhận là di sản thế giới kép từ năm 2014. Tràng An với hệ thống dãy núi đá vôi có tuổi địa chất khoảng 250 triệu năm, qua thời gian dài phong hóa bởi sự biến đổi của Trái Đất, khí hậu, biển tiến, biển thoái đã mang trong mình hàng trăm thung lũng, hang động, hồ đầm. Danh thắng này là nơi bảo tồn và chứa đựng nhiều hệ sinh thái rừng ngập nước, rừng trên núi đá vôi, các di chỉ khảo cổ học và di tích lịch sử văn hóa. Hệ thống núi đá, sông suối, rừng và hang động ở Tràng An rất hiểm trở nên được Vua Đinh Tiên Hoàng chọn làm thành Nam bảo vệ kinh đô Hoa Lư ở thế kỷ X và sau đó Nhà Trần sử dụng làm hành cung Vũ Lâm trong kháng chiến Nguyên Mông. Hiện nay nơi đây còn nhiều di tích lịch sử thời Đinh và thời Trần.","['Biển', 'Núi', 'Lịch sử', 'Văn hóa', 'Thiên nhiên', 'Giải trí']",,,
1037,Công Viên Nước Rio,Long An,Thiên nhiên,4.7,0,10.8405298,106.4265452,"Công Viên Nước Rio là điểm vui chơi giải trí hấp dẫn tại Long An. Với nhiều hoạt động thú vị và không gian xanh mát, nơi đây là lựa chọn hoàn hảo cho các gia đình và du khách.","['Thiên nhiên', 'Giải trí']",,,
1038,Biển quất lâm- Nam Định,Nam Định,Biển,4.1,0,20.1907988,106.3823728,Biển quất lâm- Nam Định là điểm đến du lịch hấp dẫn tại Nam Định. Nơi đây thu hút du khách bởi vẻ đẹp độc đáo và những trải nghiệm thú vị không thể bỏ qua.,['Biển'],,,
1039,Nhà Thờ Đổ Nam Định,Nam Định,Thiên nhiên,4.5,0,20.1298244,106.3142557,"Nhà Thờ Đổ Nam Định là một công trình kiến trúc tôn giáo tại Nam Định. Nhà thờ mang đậm nét kiến trúc Công giáo với những họa tiết tinh xảo, là điểm đến yên bình cho du khách muốn tìm hiểu văn hóa và tín ngưỡng.",['Thiên nhiên'],,,
1040,Vườn Quốc gia Xuân Thủy,Nam Định,Thiên nhiên,4.3,0,20.2329811,106.5700505,"Công viên đất ngập nước có rừng ngập mặn, chuyến tham quan bằng thuyền cùng các loài chim quý hiếm như cò thìa mặt đen.","['Thiên nhiên', 'Giải trí']",,,
1041,Đền Cố Trạch,Nam Định,Lịch sử,4.7,0,20.45637,106.1680728,Đền thờ có lễ hội hằng năm nhằm tưởng nhớ vị vua đánh tan quân Mông Nguyên vào thế kỷ 13.,['Lịch sử'],,,
1042,Đền Trần,Nam Định,Lịch sử,4.7,0,20.4555592,106.1679715,"Đền Trần là một quần thể đền thờ tại đường Trần Thừa, phường Nam Định, tỉnh Ninh Bình. Từ phường Hoa Lư, trung tâm tỉnh Ninh Bình tới đền Trần 33 km. Đền nằm sát quốc lộ 10, là nơi thờ các vua Trần cùng các quan lại có công phù tá nhà Trần. Đền Trần được xây dựng từ năm 1695, trên nền Thái miếu cũ của nhà Trần đã bị quân Minh phá hủy vào thế kỷ XV.",['Lịch sử'],,,
1043,Phủ Dầy Nam Định,Nam Định,Thiên nhiên,4.7,0,20.3601929,106.07489,Phủ Dầy Nam Định là di tích lịch sử quan trọng tại Nam Định. Công trình kiến trúc này mang đậm dấu ấn lịch sử và là điểm đến không thể bỏ qua cho những ai yêu thích khám phá văn hóa.,['Thiên nhiên'],,,
1044,Tượng Đài Trần Quốc Tuấn,Nam Định,Thiên nhiên,4.8,0,20.4323747,106.181967,Tượng Đài Trần Quốc Tuấn là điểm đến du lịch hấp dẫn tại Nam Định. Nơi đây thu hút du khách bởi vẻ đẹp độc đáo và những trải nghiệm thú vị không thể bỏ qua.,"['Thiên nhiên', 'Công trình']",,,
1045,Đền Lựu Phố,Nam Định,Lịch sử,4.4,0,20.4687128,106.1714322,"Lê Thị Lựu là một họa sĩ chuyên về tranh lụa và tranh sơn dầu người Việt Nam. Bà được xem là nữ họa sĩ đầu tiên của nền mỹ thuật hiện đại Việt Nam, nằm trong bộ tứ danh họa Việt tại Pháp Phổ – Thứ – Lựu – Đàm.",['Lịch sử'],,,
1046,Đền Bảo Lộc,Nam Định,Lịch sử,4.7,0,20.4678472,106.1600921,Đền Bảo Lộc là một di tích lịch sử - văn hóa quan trọng tại Nam Định. Công trình thờ tự này lưu giữ những giá trị truyền thống và là nơi diễn ra nhiều lễ hội văn hóa đặc sắc hàng năm.,"['Lịch sử', 'Thiên nhiên']",,,
1047,Cổng Thành Nghệ An,Nghệ An,Biển,4.6,0,18.6678568,105.6692769,Cổng Thành Nghệ An là điểm đến du lịch hấp dẫn tại Nghệ An. Nơi đây thu hút du khách bởi vẻ đẹp độc đáo và những trải nghiệm thú vị không thể bỏ qua.,"['Biển', 'Lịch sử']",,,
1048,Khu Di tích Kim Liên - Quê Nội Bác Hồ,Nghệ An,Lịch sử,4.6,0,18.6742,105.5546,Khu di tích tôn vinh cố lãnh tụ Hồ Chí Minh tại ngôi làng thời thưở nhỏ với những khu vườn và nhà tranh đơn sơ.,"['Lịch sử', 'Thiên nhiên']",,,
1049,Khu Du lịch Sinh thái Phà Lài,Nghệ An,Văn hóa,4.4,0,18.9423408,104.9362249,"Khu Du lịch Sinh thái Phà Lài là điểm vui chơi giải trí hấp dẫn tại Nghệ An. Với nhiều hoạt động thú vị và không gian xanh mát, nơi đây là lựa chọn hoàn hảo cho các gia đình và du khách.","['Văn hóa', 'Thiên nhiên', 'Giải trí']",,,
1050,Đồi hoa hướng dương Nghệ An,Nghệ An,Unknown,4.5,0,19.4002657,105.47444,Đồi hoa hướng dương Nghệ An là điểm đến du lịch hấp dẫn tại Nghệ An. Nơi đây thu hút du khách bởi vẻ đẹp độc đáo và những trải nghiệm thú vị không thể bỏ qua.,[],,,
1051,Thành cổ Vinh,Nghệ An,Lịch sử,4.4,0,18.6703526,105.6693819,"Tàn tích cổng thành từ thế kỷ 19, có nhiều nhà hàng món lươn và một khu chợ đêm gần đó.","['Lịch sử', 'Văn hóa']",,,
1052,Di tích lịch sử Truông Bồn,Nghệ An,Lịch sử,4.5,0,18.7863002,105.4110678,"Dưới đây là danh sách những Di tích cấp quốc gia tại Việt Nam đã được Bộ Văn hóa, Thể thao và Du lịch Việt Nam công nhận và xếp hạng mục. Các nội dung khác ngoài danh sách được nêu tại bài Di tích Việt Nam.","['Lịch sử', 'Văn hóa']",,,
1053,Cổng Trời Mường Lống,Nghệ An,Lịch sử,4.5,0,19.5307032,104.3322327,"Dốc Cổng Trời Mường Lống là dốc trên đường liên xã tới trung tâm hành chính xã Mường Lống huyện Kỳ Sơn tỉnh Nghệ An, Việt Nam.",['Lịch sử'],,,
1054,KHU DU LỊCH SINH THÁI HÒN MÁT,Nghệ An,Thiên nhiên,4.3,0,19.2079243,105.4413315,"Khu du lịch sinh thái Thung Nham là một trong những tuyến điểm du lịch thuộc vùng lõi của quần thể di sản thế giới Tràng An. Vùng du lịch này nằm trong thung đồi Hải Nham với điểm nhấn chính là đảo xem chim tự nhiên, rừng thực vật và các hang động như: động Vái Giời, động Tiên Cá, động Thủy Cung, hang Bụt,...","['Thiên nhiên', 'Giải trí']",,,
1055,Safari Mường Thanh,Nghệ An,Văn hóa,4.2,0,19.1590347,105.5105461,Safari Mường Thanh là điểm đến du lịch hấp dẫn tại Nghệ An. Nơi đây thu hút du khách bởi vẻ đẹp độc đáo và những trải nghiệm thú vị không thể bỏ qua.,"['Văn hóa', 'Thiên nhiên']",,,
1056,Thác Khe Kèm,Nghệ An,Núi,4.5,0,18.9704427,104.8007142,"Con Cuông là một huyện miền núi thuộc tỉnh Nghệ An, Việt Nam.","['Núi', 'Thiên nhiên']",,,
1057,Suối Cá Vàng Khe Tọ,Nghệ An,Thiên nhiên,4.4,0,19.3385157,105.4385425,"Nghĩa Đàn là một huyện thuộc tỉnh Nghệ An, Việt Nam.",['Thiên nhiên'],,,
