destinationId,name,province,category,averageRating,favouriteTimes,latitude,longitude,description,categories,district,openTime,closeTime
710,Phố Đi Bộ Bạch Đằng,Bình Dương,Thiên nhiên,4.5,0,10.9822198,106.6466652,"Sông Bạch Đằng là ranh giới giữa thành phố Hải Phòng và tỉnh Quảng Ninh ngày nay, gọi theo phiên âm chữ Nôm là Bạch Đằng Giang (白藤江). Từ Bạch (白) có nghĩa là trắng, từ Đằng (藤) có nghĩa là ""bụi cây quấn quýt"", tên Nôm là Dầng hay Rừng. Và ba từ ""Bạch Đằng Giang"", nghĩa là sông có ""rừng sóng bạc đầu"", mà gọi theo dân gian là sông Thần. Ngoài ra sông này còn có tên gọi khác thời Hậu Lê là Vân Cừ (澐渠), nghĩa là ""con sông nhỏ có sóng lớn"" hay ""nước chảy xoáy cuồn cuộn"", về sau là sông Thành Triền và ngày nay là sông Đá Bạc...","['Thiên nhiên', 'Giải trí']",,,
711,Tượng đài chiến thắng Bàu Bàng,Bình Dương,Công trình,4.5,0,11.2733837,106.6354072,"Bàu Bàng là một huyện cũ nằm ở phía bắc tỉnh Bình Dương, Việt Nam.",['Công trình'],,,
712,Khu Du Lịch Cao Minh,Bình Dương,Giải trí,3.9,0,11.03262,107.019326,"Khu nghỉ dưỡng bình dân trong vườn rộng 20 ha, có nhà hàng, vườn bia và không gian tổ chức sự kiện ngoài trời.",['Giải trí'],,,
713,Biển Đại Nam,Bình Dương,Biển,4.3,0,11.0433946,106.6233383,Biển Đại Nam là điểm đến du lịch hấp dẫn tại Bình Dương. Nơi đây thu hút du khách bởi vẻ đẹp độc đáo và những trải nghiệm thú vị không thể bỏ qua.,['Biển'],,,
714,Đình Tân An,Bình Dương,Thiên nhiên,4.5,0,11.0195487,106.6182765,Đình Tân An là một di tích lịch sử - văn hóa quan trọng tại Bình Dương. Công trình thờ tự này lưu giữ những giá trị truyền thống và là nơi diễn ra nhiều lễ hội văn hóa đặc sắc hàng năm.,['Thiên nhiên'],,,
715,CÔNG VIÊN NƯỚC THANH LỄ BÌNH DƯƠNG,Bình Dương,Thiên nhiên,3.5,0,10.9889706,106.6629663,"CÔNG VIÊN NƯỚC THANH LỄ BÌNH DƯƠNG là điểm vui chơi giải trí hấp dẫn tại Bình Dương. Với nhiều hoạt động thú vị và không gian xanh mát, nơi đây là lựa chọn hoàn hảo cho các gia đình và du khách.","['Thiên nhiên', 'Giải trí']",,,
716,Du lịch xanh Dìn Ký Cổng chào Bình Dương,Bình Dương,Lịch sử,3.9,0,10.8720435,106.7128536,Du lịch xanh Dìn Ký Cổng chào Bình Dương là điểm đến du lịch hấp dẫn tại Bình Dương. Nơi đây thu hút du khách bởi vẻ đẹp độc đáo và những trải nghiệm thú vị không thể bỏ qua.,"['Lịch sử', 'Thiên nhiên']",,,
717,Du lịch xanh Dìn Ký Lái Thiêu - Cầu Ngang,Bình Dương,Công trình,3.9,0,10.9219786,106.6858845,"Tỉnh lộ 745 hay còn gọi là ĐT.745 là tuyến đường nội tỉnh của tỉnh Bình Dương, Việt Nam.",['Công trình'],,,
718,Thanh An Tự - Quan Đế Miếu (Chùa Ông Ngựa),Bình Dương,Lịch sử,4.5,0,10.9783254,106.655778,"Quan Vũ, hay Quan Công, tự Vân Trường (雲長), là một vị tướng nổi tiếng thời kỳ cuối nhà Đông Hán và thời Tam Quốc ở Trung Quốc. Ông là người đã góp công lớn vào việc thành lập nhà Thục Hán, nhưng thất bại của ông khi đóng giữ Kinh Châu là một trong những nguyên nhân dẫn đến việc nhà Thục Hán bị suy yếu đáng kể.",['Lịch sử'],,,
719,Đồng Sến Farmstays,Bình Dương,Unknown,3.9,0,11.4100999,106.388276,Đồng Sến Farmstays là điểm đến du lịch hấp dẫn tại Bình Dương. Nơi đây thu hút du khách bởi vẻ đẹp độc đáo và những trải nghiệm thú vị không thể bỏ qua.,[],,,
720,Thác Voi,Bình Phước,Thiên nhiên,4.0,0,11.8211875,107.3821709,"Thác Voi là thác trên dòng suối Đa Mlo tại vùng đất Thôn 8 xã Đồng Nai huyện Bù Đăng tỉnh Bình Phước, Việt Nam. Thác nằm trong quần thể danh thắng Trảng cỏ Bù Lạch, thác rộng 13m, cao 14m, dốc 90 độ.",['Thiên nhiên'],,,
721,Thác Đứng,Bình Phước,Thiên nhiên,4.2,0,11.7762591,107.2152574,Thác Đứng là điểm đến du lịch hấp dẫn tại Bình Phước. Nơi đây thu hút du khách bởi vẻ đẹp độc đáo và những trải nghiệm thú vị không thể bỏ qua.,['Thiên nhiên'],,,
722,Vườn Quốc gia Bù Gia Mập,Bình Phước,Thiên nhiên,4.2,0,12.1454059,107.1558055,"Rừng cây từng chứng kiến cuộc chiến tranh Việt Nam ác liệt, nay có lối đi bộ dẫn đến thác nước và khu động vật hoang dã.",['Thiên nhiên'],,,
723,Thác Đắk Mai,Bình Phước,Biển,4.4,0,12.0624203,107.1841926,"Đắk Lắk là tỉnh miền núi ven biển nằm ở vùng Nam Trung Bộ, miền Trung của Việt Nam. Tỉnh lỵ của tỉnh là thành phố Buôn Ma Thuột.","['Biển', 'Núi', 'Thiên nhiên']",,,
724,Hồ Suối Lam,Bình Phước,Thiên nhiên,4.3,0,11.6102394,106.8813726,"Đồng Xoài là thành phố tỉnh lỵ của tỉnh Bình Phước, vùng Đông Nam Bộ, Việt Nam.",['Thiên nhiên'],,,
725,Khu Du Lịch Đảo Yến Sơn Hà,Bình Phước,Biển,4.0,0,11.4520559,106.8573822,Côn Đảo là một quần đảo nằm ở ngoài khơi bờ biển Nam Bộ và cũng là một đặc khu trực thuộc Thành phố Hồ Chí Minh.,"['Biển', 'Thiên nhiên', 'Giải trí']",,,
726,Lâm Viên Mỹ Lệ,Bình Phước,Unknown,3.6,0,11.7750655,106.8980187,Lâm Viên Mỹ Lệ là điểm đến du lịch hấp dẫn tại Bình Phước. Nơi đây thu hút du khách bởi vẻ đẹp độc đáo và những trải nghiệm thú vị không thể bỏ qua.,[],,,
727,Khu Bảo tồn Văn hóa dân tộc S'tiêng,Bình Phước,Văn hóa,4.3,0,11.8382172,107.1954622,Khu Bảo tồn Văn hóa dân tộc S'tiêng là điểm đến du lịch hấp dẫn tại Bình Phước. Nơi đây thu hút du khách bởi vẻ đẹp độc đáo và những trải nghiệm thú vị không thể bỏ qua.,"['Văn hóa', 'Thiên nhiên']",,,
728,Chùa Phật Mẫu,Bình Phước,Lịch sử,4.6,0,11.4291761,106.5470007,"Chùa Linh Phước tọa lạc tại số 120 Tự Phước, thuộc địa bàn Trại Mát, cách trung tâm thành phố Đà Lạt 8 km, trên quốc lộ 20. Chùa còn được gọi là Chùa Ve Chai vì trong sân chùa có con rồng dài 49 m được làm bằng 12.000 vỏ chai lọ. Chùa Linh Phước là một công trình kiến trúc khảm sành đặc sắc của thành phố Đà Lạt.",['Lịch sử'],,,
729,Gành Son,Bình Thuận,Biển,4.2,0,11.1831703,108.6215311,"Tuy Phong là một huyện ven biển nằm ở phía đông bắc tỉnh Bình Thuận, Việt Nam.",['Biển'],,,
730,Suối Tiên - Mũi Né,Bình Thuận,Biển,3.8,0,10.9512201,108.25634,"Mũi Né là một địa danh, tên một mũi biển và cũng là một phường ở thành phố Phan Thiết, tỉnh Bình Thuận, Việt Nam. Đây là một khu du lịch nổi tiếng của tỉnh Bình Thuận và là một trong số các khu du lịch quốc gia của Việt Nam.","['Biển', 'Thiên nhiên', 'Giải trí']",,,
731,Khu du lịch Thác 3 Tầng,Bình Thuận,Núi,4.0,0,11.3643318,107.5666997,"Khu du lịch Núi Bà Đen là tập hợp các điểm du lịch nằm trong quần thể núi Bà Đen thuộc địa phận phường Ninh Sơn, phường Ninh Thạnh, xã Thạnh Tân của thành phố Tây Ninh và một phần xã Suối Đá, xã Phan của huyện Dương Minh Châu. Khu du lịch hiện đang sở hữu Kỷ lục Thế giới Guinness với công trình ga Bà Đen là ""Nhà ga cáp treo lớn nhất thế giới"". Ngoài ra, còn có Tượng Phật Bà Tây Bổ Đà Sơn với hai kỷ lục ""Tượng Phật Bà bằng đồng cao nhất châu Á tọa lạc trên đỉnh núi"" và ""Tượng Phật Bà bằng đồng cao nhất Việt Nam tọa lạc trên đỉnh núi""; Tượng Phật Di Lạc với kỷ lục ""Tượng Phật Di Lạc bằng đá sa thạch lớn nhất thế giới"" cùng hệ thống thác nước xung quanh tượng với kỷ lục ""Thác nước nhân tạo có độ cao cao nhất châu Á"". Đây cũng là nơi đầu tiên của Việt Nam vận hành loại hình du lịch máng trượt và cáp treo.","['Núi', 'Thiên nhiên', 'Giải trí']",,,
732,Bãi biển Đồi Dương,Bình Thuận,Biển,4.2,0,10.9242215,108.1150157,"Bãi biển đô thị này là nơi an toàn để bơi lội, có lối đi bộ, các quầy hàng bán món ăn đường phố, nhà hàng và khách sạn.",['Biển'],,,
733,Bãi Biển Mũi Né,Bình Thuận,Biển,4.2,0,10.9537503,108.3065046,"Mũi Né là một địa danh, tên một mũi biển và cũng là một phường ở thành phố Phan Thiết, tỉnh Bình Thuận, Việt Nam. Đây là một khu du lịch nổi tiếng của tỉnh Bình Thuận và là một trong số các khu du lịch quốc gia của Việt Nam.","['Biển', 'Giải trí']",,,
734,Làng chài Mũi Né,Bình Thuận,Unknown,3.9,0,10.9410098,108.2791267,Ngôi làng này là nơi thu hút đông đảo du khách đến xem các loại cá được đánh bắt về đất liền và thưởng thức hải sản tươi sống.,[],,,
735,Chùa Cổ Thạch,Bình Thuận,Biển,4.4,0,11.179938,108.717255,"Chùa lộng lẫy có từ thế kỷ 19 nhìn ra biển, có các bức tượng điêu khắc động vật sặc sỡ và rắn naga chạm khắc.","['Biển', 'Lịch sử']",,,
736,Bảo tàng nước mắm Làng Chài Xưa - Fish Sauce Museum,Bình Thuận,Văn hóa,4.2,0,10.93922,108.1648321,"Bảo tàng nước mắm Làng Chài Xưa - Fish Sauce Museum là bảo tàng nổi tiếng tại Bình Thuận, nơi trưng bày và bảo tồn nhiều hiện vật quý giá. Du khách có thể khám phá lịch sử, văn hóa và di sản thông qua các bộ sưu tập đa dạng.",['Văn hóa'],,,
737,Thác Chín Tầng,Bình Thuận,Thiên nhiên,4.6,0,11.3271214,107.8468166,"Bình Dương là một tỉnh cũ thuộc vùng Đông Nam Bộ, Việt Nam. Ngày 12 tháng 6 năm 2025, tỉnh Bình Dương được sáp nhập vào Thành phố Hồ Chí Minh.",['Thiên nhiên'],,,
738,Hải Đăng Kê Gà,Bình Thuận,Biển,4.4,0,10.6952887,107.9915644,"Ngọn hải đăng bằng đá có từ năm 1897 nằm trên đỉnh núi đá đầy màu sắc, trông ra biển rộng & bờ cát trắng.","['Biển', 'Núi']",,,
739,Điểm du lịch - Vịnh Triều Dương,Bình Thuận,Biển,4.4,0,10.5050625,108.9608125,"Ninh Thuận là một tỉnh cũ ven biển gần cực nam vùng duyên hải Nam Trung Bộ, miền Trung của Việt Nam.",['Biển'],,,
740,Đồi Cát Đỏ,Bình Thuận,Biển,4.1,0,10.9492961,108.2963502,"Khu vực cồn cát ấn tượng nhìn ra biển, nổi tiếng với trò chơi trượt cát và ngắm cảnh hoàng hôn.",['Biển'],,,
741,Du lịch Sinh Thái Bàu Trắng - Minh Thái,Bình Thuận,Biển,4.2,0,11.0609478,108.4279477,"Ninh Thuận là một tỉnh cũ ven biển gần cực nam vùng duyên hải Nam Trung Bộ, miền Trung của Việt Nam.",['Biển'],,,
742,Hòn Rơm,Bình Thuận,Biển,4.3,0,10.9537264,108.3350742,"Hòn Rơm là danh thắng thiên nhiên nổi tiếng tại Bình Thuận. Với cảnh quan hùng vĩ và không khí trong lành, nơi đây thu hút du khách đến leo núi, ngắm cảnh và khám phá thiên nhiên hoang sơ.",['Biển'],,,
743,Làng Chài Hòn Rơm,Bình Thuận,Biển,4.1,0,10.9582317,108.3271778,Làng Chài Hòn Rơm là làng nghề truyền thống tại Bình Thuận. Du khách có thể trải nghiệm cuộc sống thôn quê thanh bình và tìm hiểu các nghề thủ công đặc sắc của địa phương.,['Biển'],,,
744,Dinh Thầy Thím,Bình Thuận,Văn hóa,4.5,0,10.7234742,107.8445932,Khu tổ hợp dinh kiểu làng quê với những bức tượng và tác phẩm chạm khắc sặc sỡ và là nơi tổ chức lễ hội văn hóa hằng năm.,['Văn hóa'],,,
745,Mian FARM Bình Thuận,Bình Thuận,Unknown,4.3,0,11.0545303,108.40395,Mian FARM Bình Thuận là điểm đến du lịch hấp dẫn tại Bình Thuận. Nơi đây thu hút du khách bởi vẻ đẹp độc đáo và những trải nghiệm thú vị không thể bỏ qua.,[],,,
746,Fishermen Show Theatre - Huyền Thoại Làng Chài,Bình Thuận,Unknown,4.3,0,10.9387832,108.1644267,Fishermen Show Theatre - Huyền Thoại Làng Chài là điểm đến du lịch hấp dẫn tại Bình Thuận. Nơi đây thu hút du khách bởi vẻ đẹp độc đáo và những trải nghiệm thú vị không thể bỏ qua.,[],,,
747,Bãi Biển Tiến Thành,Bình Thuận,Biển,4.4,0,10.8587042,108.0499396,"Bãi Biển Tiến Thành là bãi biển đẹp nằm tại Bình Thuận với bờ cát trắng mịn và làn nước trong xanh. Đây là điểm đến lý tưởng để tắm biển, thư giãn và ngắm hoàng hôn tuyệt đẹp.",['Biển'],,,
748,Gành Hang,Bình Thuận,Biển,4.7,0,10.5159497,108.9665806,Gành Hang là điểm đến du lịch hấp dẫn tại Bình Thuận. Nơi đây thu hút du khách bởi vẻ đẹp độc đáo và những trải nghiệm thú vị không thể bỏ qua.,"['Biển', 'Thiên nhiên']",,,
749,Suối NƯỚC NÓNG Bưng Thị,Bình Thuận,Thiên nhiên,4.2,0,10.7730494,107.931609,"Bến Cát là một thành phố cũ nằm ở trung tâm tỉnh Bình Dương, Việt Nam.",['Thiên nhiên'],,,
750,Công Viên Đồi Dương,Bình Thuận,Thiên nhiên,4.3,0,10.9255169,108.1156513,"Bình Dương là một tỉnh cũ thuộc vùng Đông Nam Bộ, Việt Nam. Ngày 12 tháng 6 năm 2025, tỉnh Bình Dương được sáp nhập vào Thành phố Hồ Chí Minh.","['Thiên nhiên', 'Giải trí']",,,
751,Bikini Beach - Công viên Bãi biển,Bình Thuận,Biển,4.3,0,10.851445,108.04636,"Bóng chuyền bãi biển là một phiên bản bóng chuyển chơi trên mặt sân cát, giữa 2 đội với 2 thành viên mỗi đội và đã trở thành một môn thể thao ở thế vận hội từ năm 1996.","['Biển', 'Giải trí']",,,
752,Bãi Đá 7 Màu,Bình Thuận,Biển,4.1,0,11.1750403,108.7112507,Bãi Đá 7 Màu là điểm đến du lịch hấp dẫn tại Bình Thuận. Nơi đây thu hút du khách bởi vẻ đẹp độc đáo và những trải nghiệm thú vị không thể bỏ qua.,['Biển'],,,
753,Red Canyon,Bình Thuận,Unknown,4.1,0,10.9550902,108.2586222,"Phim khiêu dâm, là những bộ phim mô tả quan hệ tình dục một cách rõ ràng với mục đích kích thích tình dục và tạo ra sự hài lòng về tình dục cho người xem. Phim khiêu dâm thể hiện các ảo tưởng về tình dục và thường bao gồm các yếu tố kích thích tình dục như khoả thân và hình ảnh chi tiết về quan hệ tình dục. Một số khác biệt giữa phim ""gợi tình"" và phim ""khiêu dâm"" dựa trên cơ sở phim khiêu dâm có hình ảnh tình dục rõ ràng hơn, tập trung nhiều vào cảm hứng tình dục hơn là kể chuyện, nhưng việc phân biệt giữa hai loại phim này khá là chủ quan. Tùy theo luật pháp và quan điểm đạo đức của mỗi quốc gia, phim khiêu dâm có thể là hợp pháp, bán hợp pháp hoặc bất hợp pháp.",[],,,
754,Bãi tắm Đồi Dương,Bình Thuận,Biển,4.1,0,10.6695577,107.7914361,"Ninh Thuận là một tỉnh cũ ven biển gần cực nam vùng duyên hải Nam Trung Bộ, miền Trung của Việt Nam.",['Biển'],,,
755,Chùa Monivongsa Bopharam,Cà Mau,Lịch sử,4.5,0,9.1810276,105.1410216,"Chùa Dơi là một ngôi chùa có kiến trúc hòa trộn giữa hai nền văn hóa Việt Nam – Campuchia tại tỉnh Sóc Trăng. Chùa còn có tên là Serây tê chô mahatúp, trong tiếng Khmer có nghĩa là do phúc đức tạo nên.","['Lịch sử', 'Văn hóa']",,,
756,Khu Du Lịch Sinh Thái Cà Mau Eco,Cà Mau,Thiên nhiên,3.8,0,9.1975077,104.9819448,"Khu Du Lịch Sinh Thái Cà Mau Eco là điểm vui chơi giải trí hấp dẫn tại Cà Mau. Với nhiều hoạt động thú vị và không gian xanh mát, nơi đây là lựa chọn hoàn hảo cho các gia đình và du khách.","['Thiên nhiên', 'Giải trí']",,,
757,Khu Tưởng niệm Chủ tịch Hồ Chí Minh,Cà Mau,Thiên nhiên,4.4,0,9.1852396,105.1371713,Khu Tưởng niệm Chủ tịch Hồ Chí Minh là điểm đến du lịch hấp dẫn tại Cà Mau. Nơi đây thu hút du khách bởi vẻ đẹp độc đáo và những trải nghiệm thú vị không thể bỏ qua.,['Thiên nhiên'],,,
758,Chùa Sắc Tứ Quan Âm Cổ Tự,Cà Mau,Lịch sử,4.5,0,9.185224999999999,105.1506012,"Chùa Hương hay Hương Sơn là một quần thể văn hóa - tôn giáo của Việt Nam, gồm hàng chục ngôi chùa thờ Phật, các ngôi đền thờ Thần và các ngôi đình thờ tín ngưỡng nông nghiệp. Trung tâm của cụm đình đền chùa này là chùa Hương nằm trong động Hương Tích ở hữu ngạn sông Đáy, thuộc xã Hương Sơn, huyện Mỹ Đức, Hà Nội. Quần thể Hương Sơn là một trong 21 Khu du lịch Quốc gia của Việt Nam và là Di tích Quốc gia Đặc biệt theo quyết định 2082/QĐ-TTg năm 2017.","['Lịch sử', 'Văn hóa', 'Giải trí']",,,
759,Chùa Bà Thiên Hậu Cà Mau,Cà Mau,Biển,4.7,0,9.1777868,105.1465255,"Chùa Bà Thiên Hậu Cà Mau là một ngôi chùa cổ kính tọa lạc tại Cà Mau. Đây là điểm đến tâm linh thu hút du khách bởi kiến trúc truyền thống, không gian thanh tịnh và những giá trị văn hóa Phật giáo đặc sắc.","['Biển', 'Lịch sử']",,,
760,Khu Du Lịch Khai Long,Cà Mau,Biển,3.8,0,8.566853,104.8286532,"Khu Du Lịch Khai Long là điểm vui chơi giải trí hấp dẫn tại Cà Mau. Với nhiều hoạt động thú vị và không gian xanh mát, nơi đây là lựa chọn hoàn hảo cho các gia đình và du khách.","['Biển', 'Giải trí']",,,
761,Mốc Toạ độ Quốc gia GPS 0001,Cà Mau,Unknown,4.5,0,8.606878199999999,104.7207711,Mốc Toạ độ Quốc gia GPS 0001 là điểm đến du lịch hấp dẫn tại Cà Mau. Nơi đây thu hút du khách bởi vẻ đẹp độc đáo và những trải nghiệm thú vị không thể bỏ qua.,[],,,
762,Vườn Quốc Gia U Minh Hạ,Cà Mau,Thiên nhiên,4.2,0,9.1977725,104.9591809,Công viên quốc gia rộng lớn trong rừng ngập mặn với các loài thực vật bản địa và nhiều loài động vật đa dạng.,"['Thiên nhiên', 'Giải trí']",,,
763,Khu du lịch Hòn Đá Bạc,Cà Mau,Biển,4.3,0,9.176124999999999,104.8100603,"Khu du lịch Hòn Đá Bạc là điểm vui chơi giải trí hấp dẫn tại Cà Mau. Với nhiều hoạt động thú vị và không gian xanh mát, nơi đây là lựa chọn hoàn hảo cho các gia đình và du khách.","['Biển', 'Giải trí']",,,
764,Điểm Cực Nam Tổ Quốc,Cà Mau,Biển,4.6,0,8.562714399999999,104.8312191,Điểm Cực Nam Tổ Quốc là điểm đến du lịch hấp dẫn tại Cà Mau. Nơi đây thu hút du khách bởi vẻ đẹp độc đáo và những trải nghiệm thú vị không thể bỏ qua.,['Biển'],,,
765,Đền Kỳ Sầm,Cao Bằng,Biển,4.6,0,22.6936422,106.2356887,"Sầm Sơn là một thành phố ven biển thuộc tỉnh Thanh Hóa, Việt Nam.","['Biển', 'Lịch sử']",,,
766,Thác Bản Giốc,Cao Bằng,Thiên nhiên,4.6,0,22.8543452,106.7242663,"Thác nước tuyệt đẹp nằm gần biên giới Trung Quốc, dọc theo Sông Quây Sơn và đổ xuống từ độ cao 30 m.",['Thiên nhiên'],,,
767,Núi Mắt Thần,Cao Bằng,Biển,4.7,0,22.7742101,106.3176612,"Núi Thủng là một ngọn núi nhỏ ở Cao Bằng, nằm trong Công viên địa chất Non nước Cao Bằng. Ngọn núi này có một cái hang lớn tên là Phia Lông xuyên qua thân núi, khiến cho ánh sáng Mặt trời khi chiếu vào núi từ bên kia có thể thấy được khi nhìn ở vị trí đối diện. Do đó, nó còn được gọi là núi Mắt Thần. Trong tiếng Tày, tên núi Phja Piót nghĩa là ""cái núi bị thủng một lỗ, dùi xuyên qua như để gió lùa thông thống bên nọ sang bên kia"".","['Biển', 'Núi', 'Thiên nhiên', 'Giải trí']",,,
768,Cổng trời Cao Bằng,Cao Bằng,Lịch sử,4.1,0,22.8317618,106.3202079,"Hán Cao Tổ, húy Lưu Bang (劉邦), biểu tự Quý (季), là vị hoàng đế khai quốc của triều đại nhà Hán trong lịch sử Trung Quốc. Ông ở ngôi Hoàng đế gần 7 năm, nếu tính cả thời gian đầu thì thời gian ở ngôi tổng cộng là gần 12 năm.",['Lịch sử'],,,
769,Khu Du Lịch Sinh Thái Hồ Thang Hen,Cao Bằng,Thiên nhiên,3.8,0,22.7589976,106.2971985,"Khu Du Lịch Sinh Thái Hồ Thang Hen là điểm vui chơi giải trí hấp dẫn tại Cao Bằng. Với nhiều hoạt động thú vị và không gian xanh mát, nơi đây là lựa chọn hoàn hảo cho các gia đình và du khách.","['Thiên nhiên', 'Giải trí']",,,
770,Hang Cốc Bó,Cao Bằng,Núi,4.5,0,22.9870789,106.0504031,"Hang Cốc Bó hay hang Cốc Pó là hang trong núi Các Mác ở vùng đất làng Pác Bó xã Trường Hà huyện Hà Quảng tỉnh Cao Bằng, Việt Nam.","['Núi', 'Thiên nhiên']",,,
771,Đồi Cỏ Cháy Vinh Quý,Cao Bằng,Unknown,4.7,0,22.6726088,106.6174982,"Võ Tắc Thiên hay Vũ Tắc Thiên, thường gọi Võ hậu (武后) hoặc Thiên hậu (天后), là một phi tần ở hậu cung của Đường Thái Tông Lý Thế Dân, sau trở thành Hoàng hậu thứ hai của Đường Cao Tông Lý Trị, về sau trở thành Hoàng đế triều đại Võ Chu làm gián đoạn nhà Đường. Bà là mẹ của 2 vị hoàng đế kế tiếp, Đường Trung Tông Lý Hiển và Đường Duệ Tông Lý Đán.",[],,,
772,Núi Các Mác,Cao Bằng,Núi,4.6,0,22.984207,106.048793,"Suối Lê Nin nay thuộc di tích lịch sử Pác Bó nằm trên địa bàn xã Trường Hà, huyện Hà Quảng, cách trung tâm thành phố Cao Bằng 52 km về phía Bắc. Hồ Chí Minh sống và làm việc trong hang Cốc Bó và đặt tên dòng suối trước cửa hang là ""suối Lênin"" gắn với tên gọi là nhà cách mạng Nga là V.I.Lê Nin và ngọn núi có hang này là ""núi Các Mác"" là núi được đặt tên theo Nhà Cách Mạng Đức Các Mác. Suối Lê nin là đầu nguồn của Sông Bằng. Sông Bằng chảy qua thành phố Cao Bằng, rồi qua cửa khẩu Tà Lùng chảy sang Trung Quốc.","['Núi', 'Lịch sử', 'Thiên nhiên']",,,
773,Hồ Bản Viết,Cao Bằng,Thiên nhiên,4.5,0,22.8019413,106.6001594,Hồ Bản Viết là điểm đến du lịch hấp dẫn tại Cao Bằng. Nơi đây thu hút du khách bởi vẻ đẹp độc đáo và những trải nghiệm thú vị không thể bỏ qua.,['Thiên nhiên'],,,
774,Rừng trúc Nguyên Bình,Cao Bằng,Thiên nhiên,4.4,0,22.6826802,105.8440832,Rừng trúc Nguyên Bình là điểm đến du lịch hấp dẫn tại Cao Bằng. Nơi đây thu hút du khách bởi vẻ đẹp độc đáo và những trải nghiệm thú vị không thể bỏ qua.,['Thiên nhiên'],,,
775,Khu du lịch sinh thái cộng đồng Kŏtam,Đắk Lắk,Thiên nhiên,4.4,0,12.6912825,108.1149267,"Khu nghỉ dưỡng sinh thái và trung tâm sự kiện tọa lạc giữa khung cảnh đại ngàn với hồ nước, vườn cây và nhà hàng.","['Thiên nhiên', 'Giải trí']",,,
776,Bảo tàng Đắk Lắk,Đắk Lắk,Núi,4.5,0,12.6760325,108.042094,"Bảo tàng Đắk Lắk là bảo tàng nổi tiếng tại Đắk Lắk, nơi trưng bày và bảo tồn nhiều hiện vật quý giá. Du khách có thể khám phá lịch sử, văn hóa và di sản thông qua các bộ sưu tập đa dạng.","['Núi', 'Lịch sử', 'Văn hóa', 'Thiên nhiên']",,,
777,Khu Du lịch Buôn Đôn - Ánh Dương,Đắk Lắk,Thiên nhiên,3.8,0,12.9145661,107.8178515,"Bản Đôn là một địa danh nổi tiếng của Việt Nam, cũng được nhiều người trên thế giới biết đến như là một nơi có truyền thống săn bắt và thuần dưỡng voi rừng. Bản Đôn trước đây đã từng là thủ phủ của tỉnh Đắk Lắk, sau này để tiện cho việc phát triển kinh tế xã hội và để chiếm giữ một vị trí an ninh quốc phòng chiến lược, người Pháp đã cho dời cơ quan hành chính về Buôn Ma Thuột.","['Thiên nhiên', 'Giải trí']",,,
778,Khu du lịch Hồ Lắk,Đắk Lắk,Biển,3.6,0,12.4126907,108.1820377,"Khu du lịch Hồ Lắk là điểm vui chơi giải trí hấp dẫn tại Đắk Lắk. Với nhiều hoạt động thú vị và không gian xanh mát, nơi đây là lựa chọn hoàn hảo cho các gia đình và du khách.","['Biển', 'Núi', 'Thiên nhiên', 'Giải trí']",,,
779,Khu Bảo tồn lan rừng vườn Troh Bư - Buôn Đôn,Đắk Lắk,Núi,3.9,0,12.7098689,107.958772,"Buôn Đôn là một huyện miền núi biên giới nằm ở phía tây tỉnh Đắk Lắk, Việt Nam.","['Núi', 'Thiên nhiên']",,,
