destinationId,category,province,averageRating,description
D001,beach,Da Nang,4.7,Beautiful My Khe Beach with white sand.
D002,cultural,Hanoi,4.6,Historic Old Quarter walking tour.
D003,nature,Quang Ninh,4.8,Ha Long Bay cruise among karst cliffs.
D004,adventure,Quang Binh,4.5,Son Doong Cave expedition for thrill seekers.
D005,food,Ho Chi Minh City,4.4,Street food night market exploration.
D006,beach,Khanh Hoa,4.3,Nha Trang snorkeling and island hopping.
D007,cultural,Hue,4.2,Imperial citadel heritage experience.
